[
  {
    "event_id": "evt_001",
    "event_name": "session_started",
    "schema_version": 1,
    "user_id": "u123",
    "session_id": "s456",
    "occurred_at": "2026-10-12T08:00:00Z",
    "properties": {
      "platform": "web"
    }
  },
  {
    "event_id": "evt_002",
    "event_name": "restaurant_view",
    "schema_version": 1,
    "user_id": "u123",
    "session_id": "s456",
    "occurred_at": "2026-10-12T08:01:00Z",
    "properties": {
      "restaurant_id": "r88"
    }
  },
  {
    "event_id": "evt_003",
    "event_name": "add_to_cart",
    "schema_version": 1,
    "user_id": "u123",
    "session_id": "s456",
    "occurred_at": "2026-10-12T08:02:00Z",
    "properties": {
      "cart_id": "c789",
      "restaurant_id": "r88",
      "item_id": "i42",
      "quantity": 1
    }
  },
  {
    "event_id": "evt_004",
    "event_name": "checkout_started",
    "schema_version": 1,
    "user_id": "u123",
    "session_id": "s456",
    "occurred_at": "2026-10-12T08:03:00Z",
    "properties": {
      "cart_id": "c789"
    }
  },
  {
    "event_id": "evt_005",
    "event_name": "order_completed",
    "schema_version": 1,
    "user_id": "u123",
    "session_id": "s456",
    "occurred_at": "2026-10-12T08:04:00Z",
    "properties": {
      "order_id": "o001",
      "cart_id": "c789",
      "restaurant_id": "r88"
    }
  }
]
